{
  "contract": "fluxklang.media",
  "version": 1,
  "exampleId": "ex.02-late-and-retroactive-cue",
  "title": "Late and retroactive cues: join in progress, retroactive window exceeded, bounded fire-late, and drop",
  "covers": ["lateCue", "retroactiveCue"],
  "notes": [
    "120 BPM at 48 kHz: 1.5625 frames per tick, beat = 24000 frames, 4/4 bar = 96000 frames.",
    "horizonFrame is the earliest frame the scheduler can still affect when the trigger arrives."
  ],
  "clocks": {
    "host": {"timebaseNumer": 125, "timebaseDenom": 3},
    "sample": [{"clockId": "smp.main", "nominalRate": 48000}],
    "musical": {"clockId": "mus.main", "ticksPerQuarter": 15360, "meter": {"numerator": 4, "denominator": 4}, "musicalMap": [{"atTicks": 0, "microsPerQuarter": 500000}]}
  },
  "actions": [
    {"actionId": "act.loop-a", "media": "audio", "timePolicy": "fixedRate", "quantize": {"timeBase": "musical", "gridTicks": 61440}, "late": {"policy": "joinInProgress", "maxLatenessMs": 50, "retroactiveMs": 40}, "notReady": "dropAndReport", "readiness": "ready", "prefetch": {"blockFrames": 4096, "blockCount": 16, "headFrames": 48000}},
    {"actionId": "act.stab", "media": "midi", "timePolicy": "tempoFollowing", "quantize": {"timeBase": "musical", "gridTicks": 15360}, "late": {"policy": "fireLate", "maxLatenessMs": 10}, "notReady": "dropAndReport", "readiness": "ready"},
    {"actionId": "act.fx", "media": "state", "quantize": {"timeBase": "musical", "gridTicks": 15360}, "late": {"policy": "drop"}, "notReady": "dropAndReport", "readiness": "ready"}
  ],
  "initialGenerations": {
    "sampleClock/smp.main": 1,
    "transport/mus.main": 1,
    "musicalMap/mus.main": 1,
    "context/ctx.main": 1
  },
  "timeline": [
    {"seq": 1, "kind": "anchor", "sampleClock": "smp.main", "generation": 1, "frame": 0, "hostTicks": 2400000000, "transport": 1, "musicalTicks": 0},
    {"seq": 2, "kind": "trigger", "triggerId": "trg.1", "actionId": "act.loop-a", "originHostTicks": 2448240000, "horizonFrame": 96736, "requires": {"sampleClock/smp.main": 1, "transport/mus.main": 1, "context/ctx.main": 1}, "note": "Pressed 10 ms after bar 2: inside the 40 ms retroactive window."},
    {"seq": 3, "kind": "outcome", "triggerId": "trg.1", "result": "joined", "assignedFrame": 96000, "frame": 96736, "startOffsetFrames": 736, "musicalMap": 1},
    {"seq": 4, "kind": "trigger", "triggerId": "trg.2", "actionId": "act.loop-a", "originHostTicks": 2498400000, "horizonFrame": 197056, "requires": {"sampleClock/smp.main": 1, "transport/mus.main": 1, "context/ctx.main": 1}, "note": "Pressed 100 ms after bar 3: outside the window, so the next bar."},
    {"seq": 5, "kind": "outcome", "triggerId": "trg.2", "result": "fired", "assignedFrame": 288000, "frame": 288000, "musicalMap": 1},
    {"seq": 6, "kind": "trigger", "triggerId": "trg.3", "actionId": "act.stab", "originHostTicks": 2555952000, "horizonFrame": 312160, "requires": {"sampleClock/smp.main": 1, "transport/mus.main": 1, "context/ctx.main": 1}, "note": "Beat boundary is 160 frames (3.3 ms) behind the horizon."},
    {"seq": 7, "kind": "outcome", "triggerId": "trg.3", "result": "firedLate", "assignedFrame": 312000, "frame": 312160, "musicalMap": 1},
    {"seq": 8, "kind": "trigger", "triggerId": "trg.4", "actionId": "act.fx", "originHostTicks": 2567976000, "horizonFrame": 336208, "requires": {"sampleClock/smp.main": 1, "transport/mus.main": 1, "context/ctx.main": 1}},
    {"seq": 9, "kind": "outcome", "triggerId": "trg.4", "result": "dropped", "reason": "late", "assignedFrame": 336000}
  ]
}
