{
  "contract": "fluxklang.media", "version": 1, "exampleId": "ex.04-tempo-mutation",
  "title": "Tempo and meter edit: musical targets re-resolve without cancellation; fixed-rate audio is the default; unavailable time-stretch fails readiness",
  "covers": ["tempoMutation", "fixedRateDefault", "timeStretchPolicy", "readiness"],
  "notes": [
    "The edit changes tempo to 150 BPM from tick 122880 (1.25 frames per tick) and the meter to 3/4; musicalMap revisions never cancel triggers.",
    "act.backing keeps its sample length after the edit (fixed rate); a tempo mismatch is advisory, not a silent stretch."
  ],
  "adapterCapabilities": {"timeStretch": false},
  "clocks": {
    "host": {"timebaseNumer": 125, "timebaseDenom": 3}, "sample": [{"clockId": "smp.main", "nominalRate": 48000}],
    "musical": {"clockId": "mus.main", "ticksPerQuarter": 15360, "meter": {"numerator": 4, "denominator": 4}, "musicalMap": [{"atTicks": 0, "microsPerQuarter": 500000}]}
  },
  "streams": [{"streamId": "str.pads-in", "ordinal": 0, "media": "midi", "direction": "capture"}],
  "actions": [
    {"actionId": "act.drums", "media": "midi", "timePolicy": "tempoFollowing", "quantize": {"timeBase": "musical", "gridTicks": 15360}, "late": {"policy": "nextBoundary"}, "notReady": "dropAndReport", "readiness": "ready"},
    {"actionId": "act.backing", "media": "audio", "timePolicy": "fixedRate", "quantize": {"timeBase": "musical", "gridTicks": 61440}, "late": {"policy": "joinInProgress", "maxLatenessMs": 50}, "notReady": "dropAndReport", "readiness": "ready", "prefetch": {"blockFrames": 4096, "blockCount": 16, "headFrames": 48000}},
    {"actionId": "act.stretch", "media": "audio", "timePolicy": "timeStretch", "quantize": {"timeBase": "musical", "gridTicks": 61440}, "late": {"policy": "drop"}, "notReady": "dropAndReport", "readiness": "unprepared", "prefetch": {"blockFrames": 4096, "blockCount": 16, "headFrames": 48000}}
  ],
  "initialGenerations": {
    "sampleClock/smp.main": 1, "transport/mus.main": 1, "musicalMap/mus.main": 1, "context/ctx.main": 1
  },
  "timeline": [
    {"seq": 1, "kind": "anchor", "sampleClock": "smp.main", "generation": 1, "frame": 0, "hostTicks": 2400000000, "transport": 1, "musicalTicks": 0},
    {"seq": 2, "kind": "trigger", "triggerId": "trg.1", "actionId": "act.backing", "originHostTicks": 2400500000, "horizonFrame": 1256, "requires": {"sampleClock/smp.main": 1, "transport/mus.main": 1, "context/ctx.main": 1}},
    {"seq": 3, "kind": "outcome", "triggerId": "trg.1", "result": "fired", "assignedFrame": 96000, "frame": 96000, "musicalMap": 1},
    {"seq": 4, "kind": "trigger", "triggerId": "trg.2", "actionId": "act.drums", "originHostTicks": 2450000000, "horizonFrame": 100256, "requires": {"sampleClock/smp.main": 1, "transport/mus.main": 1, "context/ctx.main": 1}, "target": {"timeBase": "musical", "atTicks": 184320}, "note": "Bar 4 beat 1 was frame 288000 at the old tempo."},
    {"seq": 5, "kind": "generation", "counter": "musicalMap/mus.main", "from": 1, "to": 2, "reason": "tempoEdit", "musicalMap": [{"atTicks": 0, "microsPerQuarter": 500000}, {"atTicks": 122880, "microsPerQuarter": 400000}], "meter": {"numerator": 3, "denominator": 4}},
    {"seq": 6, "kind": "anchor", "sampleClock": "smp.main", "generation": 1, "frame": 192000, "hostTicks": 2496000000, "transport": 1, "musicalTicks": 122880},
    {"seq": 7, "kind": "outcome", "triggerId": "trg.2", "result": "fired", "assignedFrame": 268800, "frame": 268800, "musicalMap": 2},
    {"seq": 8, "kind": "readiness", "actionId": "act.stretch", "from": "unprepared", "to": "preparing"},
    {"seq": 9, "kind": "readiness", "actionId": "act.stretch", "from": "preparing", "to": "failed", "reason": "timeStretchUnavailable"},
    {"seq": 10, "kind": "trigger", "triggerId": "trg.3", "actionId": "act.stretch", "originHostTicks": 2500000000, "horizonFrame": 200256, "requires": {"sampleClock/smp.main": 1, "transport/mus.main": 1, "context/ctx.main": 1}},
    {"seq": 11, "kind": "outcome", "triggerId": "trg.3", "result": "dropped", "reason": "notReady", "note": "No silent fallback to fixed rate."},
    {"seq": 12, "kind": "midiCapture", "stream": "str.pads-in", "ump": ["0x20903C64"], "hostTicks": 2484000000, "frame": 168000, "musicalTicks": 107520, "endpointProtocol": "midi1", "portProtocol": "midi1", "translatedBy": "none", "effective": "midi1", "note": "Delivered after the seq 6 anchor: frame 168000 maps back across the 120 BPM segment to tick 107520."}
  ]
}
